{
  "schemaVersion": 1,
  "project": {
    "name": "migration-skill-lab",
    "objective": "Build and validate an evidence-first Copilot workflow for React-to-Angular migration research.",
    "confidentiality": "internal"
  },
  "updatedAt": "2026-09-07",
  "sources": [
    {
      "id": "skill-architecture",
      "label": "Angular migration skill architecture",
      "kind": "internal-document",
      "location": "C:\\Obsidian\\Notes 2025\\Lely\\Angular migratie - skillarchitectuur.md"
    },
    {
      "id": "conventions-research",
      "label": "Angular migration conventions research",
      "kind": "internal-document",
      "location": "C:\\Obsidian\\Notes 2025\\Lely\\Angular migratie - conventions onderzoek.md"
    },
    {
      "id": "stage-approach",
      "label": "Angular migration stage approach and feasibility",
      "kind": "internal-document",
      "location": "C:\\Obsidian\\Notes 2025\\Lely\\Angular migratie - stageaanpak en haalbaarheid.md"
    },
    {
      "id": "product-frontend",
      "label": "Route Assistant frontend",
      "kind": "product-repository",
      "location": "C:\\Project\\frontend",
      "revision": "b1b0ab9da6ea4e3dd8aa31176841a6ac8a0b6dfe"
    },
    {
      "id": "airmile-claude-config",
      "label": "AirMile claude-config design source",
      "kind": "public-upstream",
      "location": "https://github.com/AirMile/claude-config",
      "revision": "a25190fb494efa37ce09f3377cae994d33db9529"
    },
    {
      "id": "github-agent-skills",
      "label": "GitHub Docs: About agent skills",
      "kind": "official-documentation",
      "location": "https://docs.github.com/copilot/concepts/agents/about-agent-skills"
    },
    {
      "id": "airmile-core-audit",
      "label": "AirMile core-audit design reference",
      "kind": "public-upstream",
      "location": "https://github.com/AirMile/claude-config/tree/1205499dfec8ae2498d68c1a65d9ae0d25c1b327/skills/core-audit",
      "revision": "1205499dfec8ae2498d68c1a65d9ae0d25c1b327"
    },
    {
      "id": "airmile-core-commit",
      "label": "AirMile core-commit design reference",
      "kind": "public-upstream",
      "location": "https://github.com/AirMile/claude-config/tree/1205499dfec8ae2498d68c1a65d9ae0d25c1b327/skills/core-commit",
      "revision": "1205499dfec8ae2498d68c1a65d9ae0d25c1b327"
    },
    {
      "id": "airmile-dev-manual",
      "label": "AirMile dev-manual flow-debug design reference",
      "kind": "public-upstream",
      "location": "https://github.com/AirMile/claude-config/tree/1205499dfec8ae2498d68c1a65d9ae0d25c1b327/skills/dev-manual",
      "revision": "1205499dfec8ae2498d68c1a65d9ae0d25c1b327"
    }
  ],
  "items": [
    {
      "id": "preserve-analyze-v0-reference",
      "title": "Preserve migration-analyze v0.1 reference",
      "type": "governance",
      "status": "done",
      "phase": "P1",
      "description": "Record the exact migration-analyze v0.1.0 source hashes and retain it unchanged as the historical read-only benchmark reference.",
      "dependencies": [
        "author-migration-analyze-v0"
      ],
      "evidenceValue": "high",
      "risk": "low",
      "acceptanceCriteria": [
        "The v0.1 source files remain unchanged.",
        "Every source file has a recorded SHA-256 hash.",
        "New baseline work uses a separate flow-baseline skill."
      ],
      "sourceIds": [
        "skill-architecture",
        "stage-approach"
      ],
      "openQuestions": []
    },
    {
      "id": "build-versioned-handoff-protocol",
      "title": "Build versioned three-skill handoff protocol",
      "type": "skill",
      "status": "done",
      "phase": "P1",
      "description": "Define compact Flow Contract, migration-result and verification-result artifacts, examples and a dependency-free validator without storing product code in artifacts.",
      "dependencies": [
        "build-lab-foundation"
      ],
      "evidenceValue": "high",
      "risk": "medium",
      "acceptanceCriteria": [
        "Every artifact has an explicit schema version and content hash pointers.",
        "The full example handoff chain validates.",
        "The negative validator self-test rejects an invalid contract."
      ],
      "sourceIds": [
        "skill-architecture",
        "stage-approach"
      ],
      "openQuestions": []
    },
    {
      "id": "author-flow-baseline-v0",
      "title": "Author flow-baseline v0.1",
      "type": "skill",
      "status": "done",
      "phase": "P1",
      "description": "Create a read-only skill that transforms a human-selected flow into a cited behavior baseline and draft Flow Contract without changing product code or tests.",
      "dependencies": [
        "preserve-analyze-v0-reference",
        "build-versioned-handoff-protocol"
      ],
      "evidenceValue": "high",
      "risk": "medium",
      "acceptanceCriteria": [
        "The skill requires a human-selected flow and declared artifact locations.",
        "The contract is draft and pending human approval.",
        "Coverage is evidence of test gaps, not a standalone target."
      ],
      "sourceIds": [
        "skill-architecture",
        "stage-approach"
      ],
      "openQuestions": []
    },
    {
      "id": "author-migrate-flow-v0",
      "title": "Author flow-migrate v0.1",
      "type": "skill",
      "status": "done",
      "phase": "P2",
      "description": "Create a bounded writing skill that requires an approved Flow Contract, available convention evidence, write allowlist, rollback and validation before it can change a product slice.",
      "dependencies": [
        "author-flow-baseline-v0"
      ],
      "evidenceValue": "high",
      "risk": "high",
      "acceptanceCriteria": [
        "The skill refuses draft or unapproved contracts.",
        "The skill writes React characterization tests before the Angular slice.",
        "Dependencies and host-contract changes remain outside v0.1 scope."
      ],
      "sourceIds": [
        "skill-architecture",
        "stage-approach",
        "conventions-research"
      ],
      "openQuestions": [
        "Which available Angular conventions and explicit POC design choices should be recorded for the representative POC?"
      ]
    },
    {
      "id": "author-verify-flow-v0",
      "title": "Author flow-verify v0.1",
      "type": "skill",
      "status": "done",
      "phase": "P2",
      "description": "Create an independent read-only verifier that evaluates the approved Flow Contract and migration result per criterion without repairing product code.",
      "dependencies": [
        "author-migrate-flow-v0"
      ],
      "evidenceValue": "high",
      "risk": "high",
      "acceptanceCriteria": [
        "Every criterion receives PASS, FAIL or BLOCKED.",
        "A PASS result cannot contain a non-passing criterion.",
        "Required manual host validation remains BLOCKED when unperformed."
      ],
      "sourceIds": [
        "skill-architecture",
        "stage-approach"
      ],
      "openQuestions": []
    },
    {
      "id": "validate-three-skill-workflow-v0",
      "title": "Validate three-skill workflow v0.1",
      "type": "benchmark",
      "status": "done",
      "phase": "P2",
      "description": "Validate schemas, example handoff chain, source metadata, backlog rendering and the absence of product-repository changes caused by skill authoring.",
      "dependencies": [
        "author-flow-baseline-v0",
        "author-migrate-flow-v0",
        "author-verify-flow-v0"
      ],
      "evidenceValue": "high",
      "risk": "medium",
      "acceptanceCriteria": [
        "The handoff validator accepts the valid chain and rejects its negative case.",
        "The backlog renderer self-test and consistency check pass.",
        "No source skill is installed, published or given unapproved product-write access."
      ],
      "sourceIds": [
        "skill-architecture",
        "stage-approach"
      ],
      "openQuestions": []
    },
    {
      "id": "run-line-drawer-poc-workflow",
      "title": "Run selected-line drawer POC workflow",
      "type": "benchmark",
      "status": "blocked",
      "phase": "P2",
      "description": "Run the migration skill chain for the selected floor-plan line detail-drawer POC after scope, target architecture, product-write authorization, browser automation, host validation and available convention evidence are confirmed.",
      "dependencies": [
        "collect-angular-conventions",
        "validate-three-skill-workflow-v0",
        "build-work-item-checkpoint-flow",
        "build-debug-flow"
      ],
      "evidenceValue": "high",
      "risk": "high",
      "acceptanceCriteria": [
        "A human approves the POC Flow Contract and write allowlist.",
        "The migration and verification artifacts provide evidence for every POC criterion.",
        "The representative flow is validated in the agreed Maui host environment."
      ],
      "sourceIds": [
        "stage-approach",
        "conventions-research",
        "product-frontend"
      ],
      "openQuestions": [
        "Who approves the POC scope, product writes and rollback?",
        "Which available Angular conventions and POC-specific design choices apply to the embedded detail drawer?",
        "Which Maui environment and owner provide the required manual validation?"
      ]
    },
    {
      "id": "build-debug-flow",
      "title": "Build bounded debug and re-verify flow",
      "type": "skill",
      "status": "done",
      "phase": "P2",
      "description": "Add a verify-produced failure dossier and fresh flow-debug agent with finite immediate, light and heavy repair tiers followed by mandatory independent re-verification.",